[
  {
    "id": "FWK-GOV-001",
    "catalogNumber": "1.1",
    "name": "CYBERCUBE Framework Compliance",
    "type": "Framework",
    "domain": "Governance",
    "version": "v1.3",
    "owner": "Standards Council",
    "status": "Active",
    "effective": "2026-04-22",
    "classification": "INTERNAL",
    "filename": "FWK-GOV-001 CYBERCUBE-Framework-Compliance-v1.3.md",
    "createdAt": "2026-02-10"
  },
  {
    "id": "POL-GOV-001",
    "catalogNumber": "1.2",
    "name": "CYBERCUBE Standards Governance Policy",
    "type": "Policy",
    "domain": "Governance",
    "version": "v1",
    "owner": "Standards Council",
    "status": "Active",
    "effective": "2026-01-17",
    "classification": "INTERNAL",
    "filename": "POL-GOV-001 CYBERCUBE-Standards-Governance-Policy-v1.md",
    "createdAt": "2026-02-10"
  },
  {
    "id": "STD-ERM-001",
    "catalogNumber": "1.3",
    "name": "CYBERCUBE Enterprise Risk Management (ERM) Policy",
    "type": "Policy",
    "domain": "Governance",
    "version": "v1",
    "owner": "Executive Leadership",
    "status": "Active",
    "effective": "2026-01-17",
    "classification": "INTERNAL",
    "filename": "STD-ERM-001 CYBERCUBE-Enterprise-Risk-Management-ERM-Policy-v1.md",
    "createdAt": "2026-02-10"
  },
  {
    "id": "POL-GOV-002",
    "catalogNumber": "1.4",
    "name": "CYBERCUBE Architecture Governance Policy",
    "type": "Policy",
    "domain": "Governance",
    "version": "v1",
    "owner": "Architecture Review Board (ARB)",
    "status": "Active",
    "effective": "2026-01-17",
    "classification": "INTERNAL",
    "filename": "POL-GOV-002 CYBERCUBE-Architecture-Governance-Policy-v1.md",
    "createdAt": "2026-02-10"
  },
  {
    "id": "STD-GOV-001",
    "catalogNumber": "1.5",
    "name": "CYBERCUBE Product Registry & Classification Standard",
    "type": "Standard",
    "domain": "Governance",
    "version": "v1",
    "owner": "CTO / Architecture Lead",
    "status": "Active",
    "effective": "2026-02-07",
    "classification": "INTERNAL",
    "filename": "STD-GOV-001 CYBERCUBE-Product-Registry-Classification-Standard-v1.md",
    "createdAt": "2026-02-10"
  },
  {
    "id": "STD-SEC-001",
    "catalogNumber": "2.1",
    "name": "CYBERCUBE Security Policy",
    "type": "Policy",
    "domain": "Security",
    "version": "v1",
    "owner": "CISO",
    "status": "Active",
    "effective": "2026-01-17",
    "classification": "INTERNAL",
    "filename": "STD-SEC-001 CYBERCUBE-Security-Policy-v1.md",
    "createdAt": "2026-02-10"
  },
  {
    "id": "STD-SEC-002",
    "catalogNumber": "2.2",
    "name": "CYBERCUBE Secure Coding Standard",
    "type": "Standard",
    "domain": "Security",
    "version": "v1.2",
    "owner": "Security Team",
    "status": "Active",
    "effective": "2026-04-22",
    "classification": "INTERNAL",
    "filename": "STD-SEC-002 CYBERCUBE-Secure-Coding-Standard-v1.2.md",
    "createdAt": "2026-02-10"
  },
  {
    "id": "STD-SEC-003",
    "catalogNumber": "2.3",
    "name": "CYBERCUBE Authentication & Identity Standard",
    "type": "Standard",
    "domain": "Security",
    "version": "v1",
    "owner": "Security Team",
    "status": "Active",
    "effective": "2026-01-17",
    "classification": "INTERNAL",
    "filename": "STD-SEC-003 CYBERCUBE-Authentication-Identity-Standard-v1.md",
    "createdAt": "2026-02-10"
  },
  {
    "id": "STD-SEC-004",
    "catalogNumber": "2.4",
    "name": "CYBERCUBE Authorization & Access Control Standard",
    "type": "Standard",
    "domain": "Security",
    "version": "v1",
    "owner": "Security Team",
    "status": "Active",
    "effective": "2026-01-17",
    "classification": "INTERNAL",
    "filename": "STD-SEC-004 CYBERCUBE-Authorization-Access-Control-Standard-v1.md",
    "createdAt": "2026-02-10"
  },
  {
    "id": "STD-SEC-005",
    "catalogNumber": "2.5",
    "name": "CYBERCUBE Cryptography & Key Management Standard",
    "type": "Standard",
    "domain": "Security",
    "version": "v1",
    "owner": "Security Team",
    "status": "Active",
    "effective": "2026-01-17",
    "classification": "INTERNAL",
    "filename": "STD-SEC-005 CYBERCUBE-Cryptography-Key-Management-Standard-v1.md",
    "createdAt": "2026-02-10"
  },
  {
    "id": "STD-SEC-006",
    "catalogNumber": "2.6",
    "name": "CYBERCUBE Vulnerability Management Standard",
    "type": "Standard",
    "domain": "Security",
    "version": "v1",
    "owner": "Security Team",
    "status": "Active",
    "effective": "2026-01-17",
    "classification": "INTERNAL",
    "filename": "STD-SEC-006 CYBERCUBE-Vulnerability-Management-Standard-v1.md",
    "createdAt": "2026-02-10"
  },
  {
    "id": "STD-SEC-007",
    "catalogNumber": "2.7",
    "name": "CYBERCUBE Security Incident Response Standard",
    "type": "Standard",
    "domain": "Security",
    "version": "v1",
    "owner": "Security Team",
    "status": "Active",
    "effective": "2026-01-17",
    "classification": "INTERNAL",
    "filename": "STD-SEC-007 CYBERCUBE-Security-Incident-Response-Standard-v1.md",
    "createdAt": "2026-02-10"
  },
  {
    "id": "STD-SEC-008",
    "catalogNumber": "2.8",
    "name": "CYBERCUBE Security Training Policy",
    "type": "Policy",
    "domain": "Security",
    "version": "v1",
    "owner": "Security Team + HR",
    "status": "Active",
    "effective": "2026-01-17",
    "classification": "INTERNAL",
    "filename": "STD-SEC-008 CYBERCUBE-Security-Training-Policy-v1.md",
    "createdAt": "2026-02-10"
  },
  {
    "id": "POL-PRI-001",
    "catalogNumber": "3.1",
    "name": "CYBERCUBE Privacy Policy (Public)",
    "type": "Policy",
    "domain": "Data & Privacy",
    "version": "v1",
    "owner": "Executive Leadership / Privacy Officer",
    "status": "Active",
    "effective": "2026-01-17",
    "classification": "PUBLIC",
    "filename": "POL-PRI-001 CYBERCUBE-Privacy-Policy-Public-v1.md",
    "createdAt": "2026-02-10"
  },
  {
    "id": "POL-PRI-002",
    "catalogNumber": "3.2",
    "name": "CYBERCUBE Privacy Handling Policy",
    "type": "Policy",
    "domain": "Data & Privacy",
    "version": "v1",
    "owner": "Privacy Lead / Legal",
    "status": "Active",
    "effective": "2026-01-17",
    "classification": "INTERNAL",
    "filename": "POL-PRI-002 CYBERCUBE-Privacy-Handling-Policy-v1.md",
    "createdAt": "2026-02-10"
  },
  {
    "id": "STD-DAT-001",
    "catalogNumber": "3.3",
    "name": "CYBERCUBE Data Classification & Retention Standard",
    "type": "Standard",
    "domain": "Data & Privacy",
    "version": "v1.2",
    "owner": "Security Team / Data Protection",
    "status": "Active",
    "effective": "2026-04-22",
    "classification": "INTERNAL",
    "filename": "STD-DAT-001 CYBERCUBE-Data-Classification-Retention-Standard-v1.2.md",
    "createdAt": "2026-02-10"
  },
  {
    "id": "STD-DAT-004",
    "catalogNumber": "3.4",
    "name": "CYBERCUBE Customer Data Isolation & Multi-Tenancy Standard",
    "type": "Standard",
    "domain": "Data & Privacy",
    "version": "v1",
    "owner": "Platform Engineering / Security Architecture",
    "status": "Active",
    "effective": "2026-01-17",
    "classification": "INTERNAL",
    "filename": "STD-DAT-004 CYBERCUBE-Customer-Data-Isolation-Multi-Tenancy-Standard-v1.md",
    "createdAt": "2026-02-10"
  },
  {
    "id": "STD-DAT-002",
    "catalogNumber": "3.5",
    "name": "CYBERCUBE Soft-Delete & Lifecycle Management Standard",
    "type": "Standard",
    "domain": "Data & Privacy",
    "version": "v1",
    "owner": "Engineering Leadership",
    "status": "Active",
    "effective": "2026-01-17",
    "classification": "INTERNAL",
    "filename": "STD-DAT-002 CYBERCUBE-Soft-Delete-Lifecycle-Standard-v1.md",
    "createdAt": "2026-02-10"
  },
  {
    "id": "TPL-LGL-001",
    "catalogNumber": "3.6",
    "name": "CYBERCUBE Data Processing Agreement (DPA) Standard Template",
    "type": "Template",
    "domain": "Data & Privacy",
    "version": "v1",
    "owner": "Legal",
    "status": "Active",
    "effective": "2026-01-17",
    "classification": "INTERNAL",
    "filename": "TPL-LGL-001 CYBERCUBE-DPA-Standard-Template-v1.md",
    "createdAt": "2026-02-10"
  },
  {
    "id": "STD-LGL-001",
    "catalogNumber": "3.7",
    "name": "CYBERCUBE Legal Hold & eDiscovery Standard",
    "type": "Standard",
    "domain": "Data & Privacy",
    "version": "v1",
    "owner": "General Counsel",
    "status": "Active",
    "effective": "2026-01-17",
    "classification": "INTERNAL",
    "filename": "STD-LGL-001 CYBERCUBE-Legal-Hold-eDiscovery-Standard-v1.md",
    "createdAt": "2026-02-10"
  },
  {
    "id": "POL-REC-001",
    "catalogNumber": "3.8",
    "name": "CYBERCUBE Records Management Policy",
    "type": "Policy",
    "domain": "Data & Privacy",
    "version": "v2.0",
    "owner": "Legal + Operations",
    "status": "Active",
    "effective": "2026-04-22",
    "classification": "INTERNAL",
    "filename": "POL-REC-001 CYBERCUBE-Records-Management-Policy-v2.md",
    "createdAt": "2026-02-10"
  },
  {
    "id": "PLN-OPS-001",
    "catalogNumber": "4.1",
    "name": "CYBERCUBE Business Continuity Plan",
    "type": "Plan",
    "domain": "Operations",
    "version": "v1",
    "owner": "Chief Operating Officer",
    "status": "Active",
    "effective": "2026-01-17",
    "classification": "CONFIDENTIAL",
    "filename": "PLN-OPS-001 CYBERCUBE-Business-Continuity-Plan-v1.md",
    "createdAt": "2026-02-10"
  },
  {
    "id": "STD-OPS-002",
    "catalogNumber": "4.2",
    "name": "CYBERCUBE Backup & Disaster Recovery Standard",
    "type": "Standard",
    "domain": "Operations",
    "version": "v1",
    "owner": "SRE / Platform Engineering",
    "status": "Active",
    "effective": "2026-01-17",
    "classification": "INTERNAL",
    "filename": "STD-OPS-002 CYBERCUBE-Backup-Disaster-Recovery-Standard-v1.md",
    "createdAt": "2026-02-10"
  },
  {
    "id": "STD-OPS-004",
    "catalogNumber": "4.3",
    "name": "CYBERCUBE Incident Response & Reliability Standard",
    "type": "Standard",
    "domain": "Operations",